{
  "type": "faction",
  "name": "sanctuary_aeon",
  "folder": null,
  "system": {
    "description": "",
    "characteristics": [
      [
        {
          "name": "dexterity",
          "value": 2
        }
      ],
      [
        {
          "name": "faith",
          "value": 1
        },
        {
          "name": "intuition",
          "value": 1
        }
      ],
      [
        {
          "name": "presence",
          "value": 1
        }
      ],
      [
        {
          "name": "wits",
          "value": 1
        }
      ]
    ],
    "skills": [
      [
        {
          "name": "charm",
          "value": 1
        }
      ],
      [
        {
          "name": "empathy",
          "value": 1
        },
        {
          "name": "focus",
          "value": 1
        }
      ],
      [
        {
          "name": "academia",
          "value": 1
        },
        {
          "name": "arts",
          "value": 1
        },
        {
          "name": "perform",
          "value": 1
        }
      ],
      [
        {
          "name": "remedy",
          "value": 2
        }
      ]
    ],
    "perk": "church_ordination",
    "blessing": [
      "TODO"
    ],
    "curse": "TODO",
    "slug": "sanctuary_aeon",
    "equipment": "TODO",
    "favoredCalling": "TODO"
  },
  "_id": "Q8ZtZKWrA3qDgAYC",
  "img": "icons/sundries/flags/banner-blue.webp",
  "effects": [],
  "flags": {},
  "_stats": {
    "compendiumSource": null,
    "duplicateSource": null,
    "exportSource": null,
    "coreVersion": "13.350",
    "systemId": "fading-suns-4",
    "systemVersion": "0.0.1",
    "createdTime": 1760897547556,
    "modifiedTime": 1760897547556,
    "lastModifiedBy": "ef54fWvGiyPGgegN"
  },
  "ownership": {
    "default": 0,
    "ef54fWvGiyPGgegN": 3
  },
  "sort": 0,
  "_key": "!items!Q8ZtZKWrA3qDgAYC"
}