{
  "type": "faction",
  "name": "scravers",
  "folder": null,
  "system": {
    "description": "",
    "characteristics": [
      [
        {
          "name": "dexterity",
          "value": 1
        },
        {
          "name": "strength",
          "value": 1
        }
      ],
      [
        {
          "name": "perception",
          "value": 1
        }
      ],
      [
        {
          "name": "presence",
          "value": 2
        }
      ],
      [
        {
          "name": "wits",
          "value": 1
        }
      ]
    ],
    "skills": [
      [
        {
          "name": "charm",
          "value": 1
        },
        {
          "name": "impress",
          "value": 1
        },
        {
          "name": "knavery",
          "value": 1
        }
      ],
      [
        {
          "name": "drive",
          "value": 1
        },
        {
          "name": "pilot",
          "value": 1
        }
      ],
      [
        {
          "name": "fight",
          "value": 1
        },
        {
          "name": "contact",
          "value": 1
        },
        {
          "name": "shoot",
          "value": 1
        }
      ],
      [
        {
          "name": "sleightofhand",
          "value": 1
        },
        {
          "name": "techredemption",
          "value": 1
        }
      ],
      [
        {
          "name": "intrusion",
          "value": 1
        },
        {
          "name": "observe",
          "value": 1
        }
      ]
    ],
    "perk": "guiild_commission",
    "blessing": [
      "TODO"
    ],
    "curse": "TODO",
    "slug": "scravers",
    "equipment": "TODO",
    "favoredCalling": "TODO"
  },
  "_id": "FTb2jKqjp3vDsdYr",
  "img": "icons/sundries/flags/banner-blue.webp",
  "effects": [],
  "flags": {},
  "_stats": {
    "compendiumSource": null,
    "duplicateSource": null,
    "exportSource": null,
    "coreVersion": "13.350",
    "systemId": "fading-suns-4",
    "systemVersion": "0.0.1",
    "createdTime": 1760897547556,
    "modifiedTime": 1760897547556,
    "lastModifiedBy": "ef54fWvGiyPGgegN"
  },
  "ownership": {
    "default": 0,
    "ef54fWvGiyPGgegN": 3
  },
  "sort": 0,
  "_key": "!items!FTb2jKqjp3vDsdYr"
}