{
  "type": "faction",
  "name": "hawkwood",
  "folder": null,
  "system": {
    "description": "",
    "characteristics": [
      [
        {
          "slug": "endurance",
          "value": 2
        },
        {
          "slug": "strength",
          "value": 2
        },
        {
          "slug": "wits",
          "value": 2
        }
      ],
      [
        {
          "slug": "faith",
          "value": 1
        },
        {
          "slug": "will",
          "value": 1
        }
      ],
      [
        {
          "slug": "presence",
          "value": 2
        }
      ]
    ],
    "skills": [
      [
        {
          "slug": "charm",
          "value": 2
        },
        {
          "slug": "impress",
          "value": 2
        }
      ],
      [
        {
          "slug": "melee",
          "value": 1
        },
        {
          "slug": "shoot",
          "value": 1
        }
      ],
      [
        {
          "slug": "academia",
          "value": 1
        }
      ],
      [
        {
          "slug": "focus",
          "value": 1
        },
        {
          "slug": "vigor",
          "value": 1
        }
      ]
    ],
    "perk": "noble_title",
    "blessing": [
      "unyielding"
    ],
    "curse": "prideful",
    "slug": "hawkwood",
    "equipment": "TODO",
    "favoredCalling": "commander",
    "capabilities": [
      [
        "military_weapons",
        "slug_guns",
        "energy_guns"
      ],
      [
        "faction_lore"
      ],
      [
        "beastback",
        "shipboard_operations",
        "warfare_lore"
      ]
    ]
  },
  "_id": "mr7WBSoApi0KpCcB",
  "img": "icons/sundries/flags/banner-blue.webp",
  "effects": [],
  "flags": {},
  "_stats": {
    "compendiumSource": null,
    "duplicateSource": null,
    "exportSource": null,
    "coreVersion": "13.350",
    "systemId": "fading-suns-4",
    "systemVersion": "0.0.1",
    "createdTime": 1760897547556,
    "modifiedTime": 1760897547556,
    "lastModifiedBy": "ef54fWvGiyPGgegN"
  },
  "ownership": {
    "default": 0,
    "ef54fWvGiyPGgegN": 3
  },
  "sort": 0,
  "_key": "!items!mr7WBSoApi0KpCcB"
}