{
  "type": "faction",
  "name": "brother_battle_faction",
  "folder": null,
  "system": {
    "description": "",
    "characteristics": [
      [
        {
          "name": "dexterity",
          "value": 1
        }
      ],
      [
        {
          "name": "endurance",
          "value": 1
        }
      ],
      [
        {
          "name": "faith",
          "value": 1
        }
      ],
      [
        {
          "name": "strength",
          "value": 2
        }
      ]
    ],
    "skills": [
      [
        {
          "name": "contact",
          "value": 1
        },
        {
          "name": "shoot",
          "value": 1
        }
      ],
      [
        {
          "name": "fight",
          "value": 1
        }
      ],
      [
        {
          "name": "focus",
          "value": 1
        },
        {
          "name": "impress",
          "value": 1
        },
        {
          "name": "survival",
          "value": 1
        }
      ],
      [
        {
          "name": "remedy",
          "value": 1
        }
      ],
      [
        {
          "name": "vigor",
          "value": 1
        }
      ]
    ],
    "perk": "church_ordination",
    "blessing": [
      "TODO"
    ],
    "curse": "TODO",
    "slug": "brother_battle_faction",
    "equipment": "TODO",
    "favoredCalling": "TODO"
  },
  "_id": "KWzDNvfP9bzfZX3Y",
  "img": "icons/sundries/flags/banner-blue.webp",
  "effects": [],
  "flags": {},
  "_stats": {
    "compendiumSource": null,
    "duplicateSource": null,
    "exportSource": null,
    "coreVersion": "13.350",
    "systemId": "fading-suns-4",
    "systemVersion": "0.0.1",
    "createdTime": 1760897547556,
    "modifiedTime": 1760897547556,
    "lastModifiedBy": "ef54fWvGiyPGgegN"
  },
  "ownership": {
    "default": 0,
    "ef54fWvGiyPGgegN": 3
  },
  "sort": 0,
  "_key": "!items!KWzDNvfP9bzfZX3Y"
}