{
  "type": "faction",
  "name": "the_muster",
  "folder": null,
  "system": {
    "description": "",
    "characteristics": [
      [
        {
          "slug": "dexterity",
          "value": 2
        },
        {
          "slug": "endurance",
          "value": 2
        }
      ],
      [
        {
          "slug": "faith",
          "value": 1
        },
        {
          "slug": "will",
          "value": 1
        },
        {
          "slug": "presence",
          "value": 1
        }
      ],
      [
        {
          "slug": "strength",
          "value": 2
        }
      ]
    ],
    "skills": [
      [
        {
          "slug": "drive",
          "value": 1
        },
        {
          "slug": "pilot",
          "value": 1
        }
      ],
      [
        {
          "slug": "fight",
          "value": 1
        },
        {
          "slug": "melee",
          "value": 1
        }
      ],
      [
        {
          "slug": "impress",
          "value": 1
        }
      ],
      [
        {
          "slug": "techredemption",
          "value": 1
        },
        {
          "slug": "vigor",
          "value": 1
        }
      ],
      [
        {
          "slug": "shoot",
          "value": 1
        }
      ]
    ],
    "perk": "guild_commission",
    "blessing": [
      "bold"
    ],
    "curse": "callous",
    "slug": "the_muster",
    "equipment": "TODO",
    "favoredCalling": "mercenary",
    "capabilities": [
      [
        "faction_lore"
      ],
      [
        "special_any_equipment_capability"
      ],
      [
        "special_any_equipment_capability"
      ]
    ]
  },
  "_id": "OrBOH294NpNLJlBJ",
  "img": "icons/sundries/flags/banner-blue.webp",
  "effects": [],
  "flags": {},
  "_stats": {
    "compendiumSource": null,
    "duplicateSource": null,
    "exportSource": null,
    "coreVersion": "13.350",
    "systemId": "fading-suns-4",
    "systemVersion": "0.0.1",
    "createdTime": 1760897547556,
    "modifiedTime": 1760897547556,
    "lastModifiedBy": "ef54fWvGiyPGgegN"
  },
  "ownership": {
    "default": 0,
    "ef54fWvGiyPGgegN": 3
  },
  "sort": 0,
  "_key": "!items!OrBOH294NpNLJlBJ"
}
